{
  "schemaVersion": "1.0",
  "feature": "photo_advisor",
  "mode": "post_capture",
  "locale": "zh-Hant-HK",
  "selectedFilterId": "instant_dream",
  "consent": {
    "imageUploadAccepted": true,
    "consentVersion": "2026-06-12.phase17a.v1"
  },
  "image": {
    "contentType": "image/jpeg",
    "width": 4096,
    "height": 4096,
    "metadataStripped": true,
    "dataBase64": "OVERSIZED_IMAGE_PLACEHOLDER"
  }
}
